{
  "scenario_id": "NFCP1-LINK-MISSING",
  "task_id": "ECS-EB-036",
  "topic": "formula_parse_pass2",
  "priority": "P1",
  "platform_target": [
    "windows_desktop"
  ],
  "inputs": {
    "workbook_fixture": "research/runs/20260302-100724-excel-nonfunction-closure-pass-01/fixtures/NFCP1-LINK-MISSING-fresh.xlsx",
    "sheet_setup": [
      {
        "sheet": "Sheet1",
        "writes": [
          {
            "kind": "value",
            "address": "A1",
            "value": 1
          },
          {
            "kind": "value",
            "address": "A2",
            "value": 2
          },
          {
            "kind": "value",
            "address": "A3",
            "value": 3
          },
          {
            "kind": "value",
            "address": "B1",
            "value": 4
          },
          {
            "kind": "value",
            "address": "B2",
            "value": 5
          },
          {
            "kind": "value",
            "address": "B3",
            "value": 6
          },
          {
            "kind": "value",
            "address": "C1",
            "value": 7
          },
          {
            "kind": "value",
            "address": "C2",
            "value": 8
          },
          {
            "kind": "value",
            "address": "C3",
            "value": 9
          },
          {
            "kind": "value",
            "address": "D1",
            "value": 0
          }
        ]
      }
    ]
  },
  "operations": [
    {
      "op": "set_calc_mode",
      "target": "workbook",
      "args": {
        "mode": "automatic"
      }
    },
    {
      "op": "edit_cell",
      "target": "Sheet1!D1",
      "args": {
        "formula": "='[MissingBook.xlsx]Sheet1'!A1",
        "allow_error": true
      }
    },
    {
      "op": "recalc",
      "target": "workbook"
    }
  ],
  "expectations": [
    {
      "assertion_id": "ASSERT-FMLP2-022",
      "kind": "manual_review",
      "target": "Sheet1!D1",
      "expected": {
        "question": "Capture parse acceptance/rejection and stored formula/value behavior for FMLP2-022."
      },
      "confidence": "medium"
    }
  ],
  "capture": {
    "raw_capture": "raw_capture.json",
    "normalized_capture": "normalized_capture.json",
    "capture_fields": [
      "value",
      "formula",
      "display_text",
      "number_format",
      "display_number_format",
      "display_interior_color",
      "display_font_color",
      "display_font_bold",
      "calc_mode"
    ]
  },
  "sources": [
    "../../../../reference/conformance/excel-worksheet-engine/model/EXCEL_FORMULA_LANGUAGE_CONCRETE_RULES.md",
    "../../../../reference/conformance/excel-worksheet-engine/model/EXCEL_FORMULA_LANGUAGE_CONFORMANCE_MATRIX.csv",
    "../../../../reference/conformance/excel-worksheet-engine/model/EXCEL_FORMULA_LANGUAGE_PASS2_PROBE_PLAN.md",
    "../../../../reference/conformance/excel-worksheet-engine/model/EXCEL_FORMULA_LANGUAGE_PASS2_SCENARIO_SEED.csv"
  ],
  "notes": "Missing external workbook behavior. | probe_id=P2-FML-006 | profile=external_workbook_missing"
}
