{
  "scenario_id": "SCN-EB016-CROSSWB-COPY-SERIAL-VALUE",
  "task_id": "ECS-EB-016",
  "topic": "now_today_date_system_wave1",
  "priority": "P0",
  "platform_target": [
    "windows_desktop"
  ],
  "inputs": {
    "workbook_fixture": "research\\runs\\20260228-180047-excel-compat-empirical-pass-01\\fixtures\\date_system_dest.xlsx",
    "sheet_setup": [
      {
        "sheet": "Sheet1",
        "writes": [
          {
            "value": "",
            "address": "A1",
            "kind": "value"
          },
          {
            "value": "yyyy-mm-dd",
            "address": "A1",
            "kind": "format"
          }
        ]
      }
    ]
  },
  "operations": [
    {
      "target": "workbook",
      "args": {
        "mode": "automatic"
      },
      "op": "set_calc_mode"
    },
    {
      "target": "workbook",
      "args": {
        "system": "1900"
      },
      "op": "set_date_system"
    },
    {
      "target": "Sheet1!A1",
      "args": {
        "source_workbook_fixture": "research\\runs\\20260228-180047-excel-compat-empirical-pass-01\\fixtures\\date_system_source.xlsx",
        "source": "Sheet1!B1"
      },
      "op": "copy_paste_from_workbook"
    },
    {
      "op": "recalc",
      "target": "workbook"
    },
    {
      "target": "workbook",
      "args": {
        "system": "1904"
      },
      "op": "set_date_system"
    },
    {
      "op": "recalc",
      "target": "workbook"
    }
  ],
  "expectations": [
    {
      "assertion_id": "ASSERT-EB016-CROSSWB-COPY-SERIAL-VALUE",
      "kind": "manual_review",
      "target": "Sheet1!A1",
      "expected": {
        "question": "For copied date serial value, how does displayed date change between 1900 and 1904 systems?"
      },
      "confidence": "high"
    }
  ],
  "capture": {
    "raw_capture": "raw_capture.json",
    "normalized_capture": "normalized_capture.json",
    "capture_fields": [
      "value",
      "formula",
      "display_text",
      "number_format",
      "calc_mode",
      "build_info",
      "platform_info"
    ]
  },
  "sources": [
    "../../20260228-130325-excel-compat-spec-index-pass-01/outputs/06_tier5_semantics_response.md"
  ],
  "notes": "Cross-workbook serial value copy + date-system transition."
}
