{
  "scenario_id": "SCN-EB015-RTD-TICKS-MANUAL",
  "task_id": "ECS-EB-015",
  "topic": "rtd_lifecycle_wave1",
  "priority": "P0",
  "platform_target": [
    "windows_desktop"
  ],
  "inputs": {
    "workbook_fixture": "research/runs/20260228-180047-excel-compat-empirical-pass-01/fixtures/rtd_lifecycle_wave1.xlsx",
    "sheet_setup": [
      {
        "sheet": "Sheet1",
        "writes": [
          {
            "address": "A1",
            "kind": "formula",
            "value": "=RTD(\"DnaCalc.Tools.RtdServer\",,\"TICKS\")"
          }
        ]
      }
    ]
  },
  "operations": [
    {
      "target": "workbook",
      "op": "set_calc_mode",
      "args": {
        "mode": "manual"
      }
    },
    {
      "target": "workbook",
      "op": "recalc"
    },
    {
      "target": "workbook",
      "op": "sleep",
      "args": {
        "milliseconds": 1200
      }
    },
    {
      "target": "workbook",
      "op": "recalc"
    },
    {
      "target": "workbook",
      "op": "sleep",
      "args": {
        "milliseconds": 1200
      }
    },
    {
      "target": "workbook",
      "op": "recalc"
    },
    {
      "target": "workbook",
      "op": "set_calc_mode",
      "args": {
        "mode": "automatic"
      }
    },
    {
      "target": "workbook",
      "op": "recalc"
    }
  ],
  "expectations": [
    {
      "assertion_id": "ASSERT-EB015-RTD-TICKS-MANUAL",
      "kind": "manual_review",
      "target": "Sheet1!A1",
      "expected": {
        "question": "How does RTD TICKS behave across manual->automatic calc mode transitions?"
      },
      "confidence": "high"
    }
  ],
  "capture": {
    "raw_capture": "raw_capture.json",
    "normalized_capture": "normalized_capture.json",
    "capture_fields": [
      "value",
      "formula",
      "display_text",
      "number_format",
      "calc_mode",
      "build_info",
      "platform_info"
    ]
  },
  "sources": [
    "../../20260228-130325-excel-compat-spec-index-pass-01/outputs/06_tier5_semantics_response.md",
    "../../20260228-130325-excel-compat-spec-index-pass-01/outputs/source_summaries_full.md"
  ],
  "notes": "Manual mode transition behavior probe."
}
