{
  "scenario_id": "SCN-EB011-NOW-RECALC",
  "task_id": "ECS-EB-011",
  "topic": "volatility_probe_wave1",
  "priority": "P0",
  "platform_target": [
    "windows_desktop"
  ],
  "inputs": {
    "workbook_fixture": "fixtures/volatility_wave1.xlsx",
    "sheet_setup": [
      {
        "sheet": "Sheet1",
        "writes": [
          {
            "address": "A1",
            "kind": "formula",
            "value": "=NOW()"
          }
        ]
      }
    ]
  },
  "operations": [
    {
      "op": "set_calc_mode",
      "target": "workbook",
      "args": {
        "mode": "automatic"
      }
    },
    {
      "op": "recalc",
      "target": "workbook"
    },
    {
      "op": "recalc",
      "target": "workbook"
    }
  ],
  "expectations": [
    {
      "assertion_id": "ASSERT-NOW-VOLATILE",
      "kind": "manual_review",
      "target": "Sheet1!A1",
      "expected": {
        "question": "Does NOW() value change between recalc events?"
      },
      "confidence": "high"
    }
  ],
  "capture": {
    "raw_capture": "raw_capture.json",
    "normalized_capture": "normalized_capture.json",
    "capture_fields": [
      "value",
      "calc_mode",
      "build_info",
      "platform_info"
    ]
  },
  "sources": [
    "../../20260228-130325-excel-compat-spec-index-pass-01/outputs/06_tier5_semantics_response.md"
  ],
  "notes": "Volatility wave1 primary volatile sample."
}
